{
  "schema_version": "1.0",
  "suite_id": "generation-paired-deidentified-v1",
  "dataset_type": "generation",
  "description": "Ten paired baseline/reviewer-candidate comparisons over shared synthetic inputs, config, and quality rubric.",
  "fixtures": {
    "plan": "../../plan_a/final_plan.demo.json",
    "review": "../../plan_a/ontology_review.demo.json",
    "valid_output": "../../plan_a/llm_workflow_output.demo.json"
  },
  "frozen_inputs": {
    "input_01": {
      "mode": "chat",
      "question": "Explain plan.",
      "expected_intent": "EXPLAIN_PLAN",
      "split": "test",
      "provenance": "synthetic_authored_v1",
      "annotator_version": "human_policy_v1.0",
      "paraphrase_family_id": "family_rs_001"
    },
    "input_02": {
      "mode": "chat",
      "question": "请说明本次方案。",
      "expected_intent": "EXPLAIN_PLAN",
      "split": "test",
      "provenance": "synthetic_authored_v1",
      "annotator_version": "human_policy_v1.0",
      "paraphrase_family_id": "family_rs_005"
    },
    "input_03": {
      "mode": "chat",
      "question": "Explain review.",
      "expected_intent": "EXPLAIN_REVIEW",
      "split": "test",
      "provenance": "synthetic_authored_v1",
      "annotator_version": "human_policy_v1.0",
      "paraphrase_family_id": "family_rs_007"
    },
    "input_04": {
      "mode": "chat",
      "question": "请说明本体评价。",
      "expected_intent": "EXPLAIN_REVIEW",
      "split": "test",
      "provenance": "synthetic_authored_v1",
      "annotator_version": "human_policy_v1.0",
      "paraphrase_family_id": "family_rs_011"
    },
    "input_05": {
      "mode": "chat",
      "question": "Explain rule.",
      "expected_intent": "EXPLAIN_RULE",
      "split": "test",
      "provenance": "synthetic_authored_v1",
      "annotator_version": "human_policy_v1.0",
      "paraphrase_family_id": "family_rs_013"
    },
    "input_06": {
      "mode": "chat",
      "question": "请说明这条规则。",
      "expected_intent": "EXPLAIN_RULE",
      "split": "test",
      "provenance": "synthetic_authored_v1",
      "annotator_version": "human_policy_v1.0",
      "paraphrase_family_id": "family_rs_017"
    },
    "input_07": {
      "mode": "chat",
      "question": "Clarify the budget recommendation.",
      "expected_intent": "EXPLAIN_PLAN",
      "split": "test",
      "provenance": "synthetic_authored_v1",
      "annotator_version": "human_policy_v1.0",
      "paraphrase_family_id": "family_generation_input_07"
    },
    "input_08": {
      "mode": "chat",
      "question": "Describe the verdict.",
      "expected_intent": "EXPLAIN_REVIEW",
      "split": "test",
      "provenance": "synthetic_authored_v1",
      "annotator_version": "human_policy_v1.0",
      "paraphrase_family_id": "family_rs_009"
    },
    "input_09": {
      "mode": "chat",
      "question": "Please explain rule R5.",
      "expected_intent": "EXPLAIN_RULE",
      "split": "test",
      "provenance": "synthetic_authored_v1",
      "annotator_version": "human_policy_v1.0",
      "paraphrase_family_id": "family_rs_014"
    },
    "input_10": {
      "mode": "chat",
      "question": "为什么本体评价冲突？",
      "expected_intent": "EXPLAIN_REVIEW",
      "split": "test",
      "provenance": "synthetic_authored_v1",
      "annotator_version": "human_policy_v1.0",
      "paraphrase_family_id": "family_rs_012"
    }
  },
  "quality_rubrics": {
    "rubric_01": {
      "dimensions": {
        "authority_fidelity": 0.4,
        "completeness": 0.25,
        "clarity": 0.15,
        "safety": 0.2
      },
      "pass_threshold": 0.85,
      "hard_gates": [
        "schema_valid",
        "authority_ids_only",
        "numeric_values_exact",
        "no_new_facts"
      ]
    }
  },
  "cases": [
    {
      "case_id": "gen_001_base",
      "category": "paired_plan",
      "scenario": "generation_eval",
      "mode": "chat",
      "expected_intent": "EXPLAIN_PLAN",
      "expected_status": "OK",
      "expected_provider_calls": 1,
      "pair_id": "pair_01",
      "comparison_arm": "baseline",
      "frozen_input_id": "input_01",
      "quality_rubric_id": "rubric_01",
      "tags": [
        "en",
        "plan",
        "baseline"
      ],
      "checks": [
        "schema_valid",
        "status_ok",
        "intent_exact",
        "authority_ids_only",
        "numeric_values_exact",
        "limitations_preserved",
        "no_new_facts",
        "retry_count_zero",
        "fallback_false",
        "answer_non_empty",
        "metadata_safe"
      ],
      "split": "test",
      "provenance": "synthetic_authored_v1",
      "annotator_version": "human_policy_v1.0",
      "paraphrase_family_id": "family_rs_001",
      "common_executor_config_id": "executor_01",
      "arm_config_id": "baseline_01",
      "candidate_id": "candidate_clean_plan",
      "observed_cost_cny": null,
      "observed_latency_ms": null,
      "arm_expectation": {
        "provider_calls": 1,
        "revision_rounds": 0,
        "status": "OK",
        "reviewer_action": "NOT_APPLICABLE"
      }
    },
    {
      "case_id": "gen_001_review",
      "category": "paired_plan",
      "scenario": "generation_eval",
      "mode": "chat",
      "expected_intent": "EXPLAIN_PLAN",
      "expected_status": "OK",
      "expected_provider_calls": 2,
      "pair_id": "pair_01",
      "comparison_arm": "reviewer_candidate",
      "frozen_input_id": "input_01",
      "quality_rubric_id": "rubric_01",
      "tags": [
        "en",
        "plan",
        "reviewer"
      ],
      "checks": [
        "schema_valid",
        "status_ok",
        "intent_exact",
        "authority_ids_only",
        "numeric_values_exact",
        "limitations_preserved",
        "no_new_facts",
        "retry_count_zero",
        "fallback_false",
        "answer_non_empty",
        "metadata_safe"
      ],
      "split": "test",
      "provenance": "synthetic_authored_v1",
      "annotator_version": "human_policy_v1.0",
      "paraphrase_family_id": "family_rs_001",
      "common_executor_config_id": "executor_01",
      "arm_config_id": "reviewer_01",
      "candidate_id": "candidate_clean_plan",
      "observed_cost_cny": null,
      "observed_latency_ms": null,
      "arm_expectation": {
        "provider_calls": 2,
        "revision_rounds": 0,
        "status": "OK",
        "reviewer_action": "PASS"
      }
    },
    {
      "case_id": "gen_002_base",
      "category": "paired_plan",
      "scenario": "generation_eval",
      "mode": "chat",
      "expected_intent": "EXPLAIN_PLAN",
      "expected_status": "OK",
      "expected_provider_calls": 1,
      "pair_id": "pair_02",
      "comparison_arm": "baseline",
      "frozen_input_id": "input_02",
      "quality_rubric_id": "rubric_01",
      "tags": [
        "zh",
        "plan",
        "baseline"
      ],
      "checks": [
        "schema_valid",
        "status_ok",
        "intent_exact",
        "authority_ids_only",
        "numeric_values_exact",
        "limitations_preserved",
        "no_new_facts",
        "retry_count_zero",
        "fallback_false",
        "answer_non_empty",
        "metadata_safe"
      ],
      "split": "test",
      "provenance": "synthetic_authored_v1",
      "annotator_version": "human_policy_v1.0",
      "paraphrase_family_id": "family_rs_005",
      "common_executor_config_id": "executor_01",
      "arm_config_id": "baseline_01",
      "candidate_id": "candidate_clean_plan",
      "observed_cost_cny": null,
      "observed_latency_ms": null,
      "arm_expectation": {
        "provider_calls": 1,
        "revision_rounds": 0,
        "status": "OK",
        "reviewer_action": "NOT_APPLICABLE"
      }
    },
    {
      "case_id": "gen_002_review",
      "category": "paired_plan",
      "scenario": "generation_eval",
      "mode": "chat",
      "expected_intent": "EXPLAIN_PLAN",
      "expected_status": "OK",
      "expected_provider_calls": 2,
      "pair_id": "pair_02",
      "comparison_arm": "reviewer_candidate",
      "frozen_input_id": "input_02",
      "quality_rubric_id": "rubric_01",
      "tags": [
        "zh",
        "plan",
        "reviewer"
      ],
      "checks": [
        "schema_valid",
        "status_ok",
        "intent_exact",
        "authority_ids_only",
        "numeric_values_exact",
        "limitations_preserved",
        "no_new_facts",
        "retry_count_zero",
        "fallback_false",
        "answer_non_empty",
        "metadata_safe"
      ],
      "split": "test",
      "provenance": "synthetic_authored_v1",
      "annotator_version": "human_policy_v1.0",
      "paraphrase_family_id": "family_rs_005",
      "common_executor_config_id": "executor_01",
      "arm_config_id": "reviewer_01",
      "candidate_id": "candidate_clean_plan",
      "observed_cost_cny": null,
      "observed_latency_ms": null,
      "arm_expectation": {
        "provider_calls": 2,
        "revision_rounds": 0,
        "status": "OK",
        "reviewer_action": "PASS"
      }
    },
    {
      "case_id": "gen_003_base",
      "category": "paired_review",
      "scenario": "generation_eval",
      "mode": "chat",
      "expected_intent": "EXPLAIN_REVIEW",
      "expected_status": "OK",
      "expected_provider_calls": 1,
      "pair_id": "pair_03",
      "comparison_arm": "baseline",
      "frozen_input_id": "input_03",
      "quality_rubric_id": "rubric_01",
      "tags": [
        "en",
        "review",
        "baseline"
      ],
      "checks": [
        "schema_valid",
        "status_ok",
        "intent_exact",
        "authority_ids_only",
        "numeric_values_exact",
        "limitations_preserved",
        "no_new_facts",
        "retry_count_zero",
        "fallback_false",
        "answer_non_empty",
        "metadata_safe"
      ],
      "split": "test",
      "provenance": "synthetic_authored_v1",
      "annotator_version": "human_policy_v1.0",
      "paraphrase_family_id": "family_rs_007",
      "common_executor_config_id": "executor_01",